{
  "artifact_id": "V0_IPEC_WP3_ADAPTER_BINDING_REGISTRY",
  "contract_id": "V0-IPEC-0.1",
  "version": "0.1",
  "date": "2026-07-19",
  "status": "WP3_ADAPTER_BINDINGS_FROZEN",
  "adapters": [
    {
      "adapter_id": "V0-IPEC-ADAPTER-VALIDATOR-CORE-0.12",
      "source_profile": "VALIDATOR_CORE_V0_12_FINITE_MODEL",
      "implementation": "checker/ipec_wp3/adapters.py::adapt_validator_core",
      "upstream_ref": "v0.12-compiler-passed-freeze",
      "upstream_commit": "3540f47198140ca0a3612f247cfe356fa7fba2cb",
      "certification_capability": "STRUCTURAL_PROXY_ONLY_NO_OSAP_SEMANTIC_CERTIFICATION"
    },
    {
      "adapter_id": "V0-IPEC-ADAPTER-OSAP-1.3.0",
      "source_profile": "OSAP_FC1_V1_1_REGISTRY",
      "implementation": "checker/ipec_wp3/adapters.py::adapt_osap_registry",
      "upstream_ref": "v1.3.0",
      "upstream_commit": "13bf095688bcabd5b090f188e9bd28a16237edeb",
      "certification_capability": "RULE_BINDING_ONLY_EVALUATION_DEFERRED_TO_WP4"
    }
  ],
  "binding_count": 40,
  "bindings": [
    {
      "binding_id": "bind.t121.1",
      "source_profile": "OSAP_FC1_V1_1_REGISTRY",
      "source_selector": "/claims[kind=has_value]",
      "rule_id": "IPEC.RULE.GUARD.001",
      "theorem_id": "T121",
      "binding_class": "EXACT_OSAP_CONSTRUCT_BINDING",
      "evaluation_mode": "DEFERRED_TO_WP4"
    },
    {
      "binding_id": "bind.t121.2",
      "source_profile": "VALIDATOR_CORE_V0_12_FINITE_MODEL",
      "source_selector": "/dom_has/*",
      "rule_id": "IPEC.RULE.GUARD.001",
      "theorem_id": "T121",
      "binding_class": "LEGACY_STRUCTURAL_PROXY_BINDING",
      "evaluation_mode": "DEFERRED_NO_SEMANTIC_CERTIFICATION"
    },
    {
      "binding_id": "bind.t122.3",
      "source_profile": "OSAP_FC1_V1_1_REGISTRY",
      "source_selector": "/prerequisite_families[mode=all_of]",
      "rule_id": "IPEC.RULE.PREREQUISITE.001",
      "theorem_id": "T122",
      "binding_class": "EXACT_OSAP_CONSTRUCT_BINDING",
      "evaluation_mode": "DEFERRED_TO_WP4"
    },
    {
      "binding_id": "bind.t123.4",
      "source_profile": "OSAP_FC1_V1_1_REGISTRY",
      "source_selector": "/claims[kind=dle]",
      "rule_id": "IPEC.RULE.DLE.001",
      "theorem_id": "T123",
      "binding_class": "EXACT_OSAP_CONSTRUCT_BINDING",
      "evaluation_mode": "DEFERRED_TO_WP4"
    },
    {
      "binding_id": "bind.t124.5",
      "source_profile": "OSAP_FC1_V1_1_REGISTRY",
      "source_selector": "/claims[kind=robust_relative_v0]",
      "rule_id": "IPEC.RULE.RESIDUAL.001",
      "theorem_id": "T124",
      "binding_class": "EXACT_OSAP_CONSTRUCT_BINDING",
      "evaluation_mode": "DEFERRED_TO_WP4"
    },
    {
      "binding_id": "bind.t124.6",
      "source_profile": "VALIDATOR_CORE_V0_12_FINITE_MODEL",
      "source_selector": "/links[type=ResidueLink]",
      "rule_id": "IPEC.RULE.RESIDUAL.001",
      "theorem_id": "T124",
      "binding_class": "LEGACY_STRUCTURAL_PROXY_BINDING",
      "evaluation_mode": "DEFERRED_NO_SEMANTIC_CERTIFICATION"
    },
    {
      "binding_id": "bind.t125.7",
      "source_profile": "OSAP_FC1_V1_1_REGISTRY",
      "source_selector": "/claims[kind=observer_terminal_self_certificate]",
      "rule_id": "IPEC.RULE.OBSERVER.001",
      "theorem_id": "T125",
      "binding_class": "EXACT_OSAP_CONSTRUCT_BINDING",
      "evaluation_mode": "DEFERRED_TO_WP4"
    },
    {
      "binding_id": "bind.t126.8",
      "source_profile": "OSAP_FC1_V1_1_REGISTRY",
      "source_selector": "/claims[kind=absolute_v0]",
      "rule_id": "IPEC.RULE.FIREWALL.001",
      "theorem_id": "T126",
      "binding_class": "EXACT_OSAP_CONSTRUCT_BINDING",
      "evaluation_mode": "DEFERRED_TO_WP4"
    },
    {
      "binding_id": "bind.t127.9",
      "source_profile": "OSAP_FC1_V1_1_REGISTRY",
      "source_selector": "/claims[kind=prerequisite_closure]",
      "rule_id": "IPEC.RULE.CLOSURE.001",
      "theorem_id": "T127",
      "binding_class": "EXACT_OSAP_CONSTRUCT_BINDING",
      "evaluation_mode": "DEFERRED_TO_WP4"
    },
    {
      "binding_id": "bind.t128.10",
      "source_profile": "OSAP_FC1_V1_1_REGISTRY",
      "source_selector": "/claims[kind=one_of_support_selection]",
      "rule_id": "IPEC.RULE.SUPPORT.001",
      "theorem_id": "T128",
      "binding_class": "EXACT_OSAP_CONSTRUCT_BINDING",
      "evaluation_mode": "DEFERRED_TO_WP4"
    },
    {
      "binding_id": "bind.t129.11",
      "source_profile": "OSAP_FC1_V1_1_REGISTRY",
      "source_selector": "/claims[kind=activation_profile]",
      "rule_id": "IPEC.RULE.COMPATIBILITY.001",
      "theorem_id": "T129",
      "binding_class": "EXACT_OSAP_CONSTRUCT_BINDING",
      "evaluation_mode": "DEFERRED_TO_WP4"
    },
    {
      "binding_id": "bind.t130.12",
      "source_profile": "OSAP_FC1_V1_1_REGISTRY",
      "source_selector": "/claims[kind=protocol_readiness]",
      "rule_id": "IPEC.RULE.READINESS.001",
      "theorem_id": "T130",
      "binding_class": "EXACT_OSAP_CONSTRUCT_BINDING",
      "evaluation_mode": "DEFERRED_TO_WP4"
    },
    {
      "binding_id": "bind.t131.13",
      "source_profile": "OSAP_FC1_V1_1_REGISTRY",
      "source_selector": "/claims[kind=dimension_result]",
      "rule_id": "IPEC.RULE.DOMAIN.001",
      "theorem_id": "T131",
      "binding_class": "EXACT_OSAP_CONSTRUCT_BINDING",
      "evaluation_mode": "DEFERRED_TO_WP4"
    },
    {
      "binding_id": "bind.t132.14",
      "source_profile": "OSAP_FC1_V1_1_REGISTRY",
      "source_selector": "/claims[kind=dle]",
      "rule_id": "IPEC.RULE.DLE.002",
      "theorem_id": "T132",
      "binding_class": "EXACT_OSAP_CONSTRUCT_BINDING",
      "evaluation_mode": "DEFERRED_TO_WP4"
    },
    {
      "binding_id": "bind.t133.15",
      "source_profile": "OSAP_FC1_V1_1_REGISTRY",
      "source_selector": "/claims[kind=fresh_token_reactivation]",
      "rule_id": "IPEC.RULE.TOKEN.001",
      "theorem_id": "T133",
      "binding_class": "EXACT_OSAP_CONSTRUCT_BINDING",
      "evaluation_mode": "DEFERRED_TO_WP4"
    },
    {
      "binding_id": "bind.t134.16",
      "source_profile": "OSAP_FC1_V1_1_REGISTRY",
      "source_selector": "/claims[kind=raw_relative_v0]",
      "rule_id": "IPEC.RULE.RESIDUAL.002",
      "theorem_id": "T134",
      "binding_class": "EXACT_OSAP_CONSTRUCT_BINDING",
      "evaluation_mode": "DEFERRED_TO_WP4"
    },
    {
      "binding_id": "bind.t134.17",
      "source_profile": "VALIDATOR_CORE_V0_12_FINITE_MODEL",
      "source_selector": "/links[type=ResidueLink]",
      "rule_id": "IPEC.RULE.RESIDUAL.002",
      "theorem_id": "T134",
      "binding_class": "LEGACY_STRUCTURAL_PROXY_BINDING",
      "evaluation_mode": "DEFERRED_NO_SEMANTIC_CERTIFICATION"
    },
    {
      "binding_id": "bind.t135.18",
      "source_profile": "OSAP_FC1_V1_1_REGISTRY",
      "source_selector": "/claims[kind=robust_relative_v0_noneliminable]",
      "rule_id": "IPEC.RULE.RESIDUAL.003",
      "theorem_id": "T135",
      "binding_class": "EXACT_OSAP_CONSTRUCT_BINDING",
      "evaluation_mode": "DEFERRED_TO_WP4"
    },
    {
      "binding_id": "bind.t136.19",
      "source_profile": "OSAP_FC1_V1_1_REGISTRY",
      "source_selector": "/claims[kind=absolute_v0]",
      "rule_id": "IPEC.RULE.FIREWALL.002",
      "theorem_id": "T136",
      "binding_class": "EXACT_OSAP_CONSTRUCT_BINDING",
      "evaluation_mode": "DEFERRED_TO_WP4"
    },
    {
      "binding_id": "bind.t137.20",
      "source_profile": "OSAP_FC1_V1_1_REGISTRY",
      "source_selector": "/claims[kind=approximation_v0]",
      "rule_id": "IPEC.RULE.FIREWALL.003",
      "theorem_id": "T137",
      "binding_class": "EXACT_OSAP_CONSTRUCT_BINDING",
      "evaluation_mode": "DEFERRED_TO_WP4"
    },
    {
      "binding_id": "bind.t137.21",
      "source_profile": "OSAP_FC1_V1_1_REGISTRY",
      "source_selector": "/claims[kind=v0_identity]",
      "rule_id": "IPEC.RULE.FIREWALL.003",
      "theorem_id": "T137",
      "binding_class": "EXACT_OSAP_CONSTRUCT_BINDING",
      "evaluation_mode": "DEFERRED_TO_WP4"
    },
    {
      "binding_id": "bind.t138.22",
      "source_profile": "OSAP_FC1_V1_1_REGISTRY",
      "source_selector": "/claims[kind=terminal_self_certification_audit]",
      "rule_id": "IPEC.RULE.OBSERVER.002",
      "theorem_id": "T138",
      "binding_class": "EXACT_OSAP_CONSTRUCT_BINDING",
      "evaluation_mode": "DEFERRED_TO_WP4"
    },
    {
      "binding_id": "bind.t139.23",
      "source_profile": "OSAP_FC1_V1_1_REGISTRY",
      "source_selector": "/claims[kind=archive_guard_export]",
      "rule_id": "IPEC.RULE.ARCHIVE.001",
      "theorem_id": "T139",
      "binding_class": "EXACT_OSAP_CONSTRUCT_BINDING",
      "evaluation_mode": "DEFERRED_TO_WP4"
    },
    {
      "binding_id": "bind.t140.24",
      "source_profile": "OSAP_FC1_V1_1_REGISTRY",
      "source_selector": "/claims[kind=independent_witness_certificate]",
      "rule_id": "IPEC.RULE.WITNESS.001",
      "theorem_id": "T140",
      "binding_class": "EXACT_OSAP_CONSTRUCT_BINDING",
      "evaluation_mode": "DEFERRED_TO_WP4"
    },
    {
      "binding_id": "bind.t141.25",
      "source_profile": "OSAP_FC1_V1_1_REGISTRY",
      "source_selector": "/claims[kind=containment]",
      "rule_id": "IPEC.RULE.CONTAINMENT.001",
      "theorem_id": "T141",
      "binding_class": "EXACT_OSAP_CONSTRUCT_BINDING",
      "evaluation_mode": "DEFERRED_TO_WP4"
    },
    {
      "binding_id": "bind.t142.26",
      "source_profile": "OSAP_FC1_V1_1_REGISTRY",
      "source_selector": "/claims[kind=branch_distinctness]",
      "rule_id": "IPEC.RULE.BRANCH.001",
      "theorem_id": "T142",
      "binding_class": "EXACT_OSAP_CONSTRUCT_BINDING",
      "evaluation_mode": "DEFERRED_TO_WP4"
    },
    {
      "binding_id": "bind.t143.27",
      "source_profile": "OSAP_FC1_V1_1_REGISTRY",
      "source_selector": "/claims[kind=cardinality_claim]",
      "rule_id": "IPEC.RULE.CARDINALITY.001",
      "theorem_id": "T143",
      "binding_class": "EXACT_OSAP_CONSTRUCT_BINDING",
      "evaluation_mode": "DEFERRED_TO_WP4"
    },
    {